id,title,company,location,job_description,job_url,salary,search_role,search_location,extracted_skills,skills_count,scraped_at
91594214,Senior Backend Software Engineer (Distributed Systems) - Online Transportation,PT Adecco Personnel Indonesia,,"ADECCO INDONESIA - Senior Backend Software Engineer (Distributed Systems) - WE ARE HIRING!  Job Title: Senior Backend Software Engineer (Distributed Systems)  Location: South Jakarta  Industry: Multinational Online Transportation Platform Company  Employment Type: 6 months contract under Adecco Indonesia (Extendable)     Get to know the Team The Fulfilment tech family is one of the pillars enabling our client to out-serve our customers and partners in different businesses and marketplaces across Southeast Asia. We are working on high throughput, real-time distributed systems that use advanced software engineering techniques to solve hundreds of millions of requests per day. We are a distributed team in 4 different locations: Singapore, Beijing, Indonesia, and Malaysia. Our communication is in English, both in spoken and written form.  Our mission is to offer the best-in-class products and experiences to our driver partners as to increase adoption and engagement of our services. Improve driver partner opportunities and efficiency in order to fulfill customer orders without fail, rain or shine. And to create efficient marketplaces by determining an optimal price that is both sustainable and loved by our partners and customers.  The Day-to-Day Activities  Design and write with the Go language to improve the availability, scalability, latency, and efficiency of our client's range of services.  Work with the engineering team to explore and create new design/architectures geared toward scale and performance.  Participate in code and design reviews to maintain our high development standards.  Engage in service capacity and demand planning, software performance analysis, tuning, and optimization.  Collaborate with product and experience teams to define and prototype feature specifications.  Work closely with the infrastructure team in building and scaling back-end services as well as performing root cause analysis investigations.  Design, build, analyze, and fix large-scale systems.  Pro-actively debug and solve production incidents during your on-call shift.  Participate in interview loops to help our client continue hiring top industry talent.  Provide technical guidance, mentorship, and knowledge sharing to peers.  The Must-Haves  A degree in Computer Science, Software Engineering, Information Technology or related fields.  5+ years of experience in software engineering in a distributed systems environment.  Experience with Golang, including an understanding of its core syntax and semantics, familiarity with its standard library, its concurrency primitives, and experience in developing and optimizing Golang applications.  Proficiency in maintaining operational excellence and site reliability, including familiarity with monitoring system performance, ensuring system health, and managing service capacity planning.  Strong Computer Science fundamentals in algorithms and data structures. Familiarity with running large-scale web services; understanding of systems internals and networking are a plus.  Experience in developing distributed systems with high throughput and scalability, including a deep understanding of streaming systems and queuing models and their respective integration into these systems.  Possess excellent communication, sharp analytical abilities with proven design skills, and the ability to think critically of the current system in terms of growth and stability.  You can be a good coder in any language (C++, C, Java, Scala, Rust, Haskell, OCaml, Erlang, Python, Ruby, PHP, Node.JS, C#, etc.), but willing to work on Golang  The Good-to-Haves  Expert knowledge in databases, including relational databases such as MySQL and NoSQL databases like AWS DynamoDB, Scylla, and others, accompanied by a distinct understanding of various design decision implications.  Capable of architecting highly scalable solutions while keeping cost-effectiveness in mind.  Experience in coaching and mentoring junior developers, providing guidance on coding standards, and promoting a collaborative learning environment within the team.  Demonstrate a keen sense of product thinking, being able to align technical strategies with product goals, and understanding how development decisions can directly impact end-users.  Tech Stack : Redis, MySQL, DynamoDB, Kafka, and Elasticsearch for data storage.  These services are orchestrated using Kubernetes and run on the AWS cloud infrastructure, equipped with auto-scaling abilities.  Our mobile app platform coverage includes native iOS, and Android, written in Swift/Kotlin, RxJava, and Flutter.  Our previously developed front-end is built on Rails, HTML5, CSS, React, and Javascript.utilizing   We use GitLab for our code repository and we adhere to the basic Continuous Delivery tenets utilising a host of tools to support our release pipeline and code quality. These include GitLab CI, DataDog, Code Climate, and Jenkins.",https://id.jobstreet.com/id/job/91594214,Rp 27.000.000 – Rp 33.000.000 per month,web,indonesia,"['kubernetes', 'swift', 'rust', 'aws', 'java', 'c++', 'android', 'golang', 'kotlin', 'php', 'c#', 'sql', 'javascript', 'scala', 'redis', 'flutter', 'kafka', 'elasticsearch', 'python', 'react', 'r', 'mysql', 'ios', 'git']",24,2026-04-20T20:54:48.632559
91594201,PowerBuilder Developer,PT Cycent Inovasi Kaizen,,"Saat ini kami sedang membuka kesempatan bagi kandidat terbaik untuk bergabung bersama kami yang akan ditempatkan di perusahaan klien kami.     Deskripsi Pekerjaan  Sebagai PowerBuilder Developer, Anda akan bertanggung jawab untuk memelihara dan meningkatkan aplikasi PowerBuilder yang sudah ada. Anda akan bekerja sama dengan developer senior untuk memastikan stabilitas sistem serta melakukan perbaikan dan pengembangan yang diperlukan.   Tanggung Jawab  Melakukan pemeliharaan, debugging, dan peningkatan pada aplikasi PowerBuilder.  Menulis dan mengoptimalkan SQL queries serta stored procedures yang kompleks.  Menganalisis serta menyelesaikan masalah aplikasi dan bottleneck performa.  Mengembangkan fitur baru dan laporan berdasarkan kebutuhan bisnis.  Mendokumentasikan perubahan kode, modifikasi sistem, dan proses teknis.  Mendukung proses data migration dan integrasi sistem jika diperlukan.  Berkolaborasi dengan pengguna bisnis untuk memahami kebutuhan dan memberikan solusi teknis.  Berpartisipasi dalam sesi knowledge transfer serta mempelajari praktik terbaik PowerBuilder.  Memastikan aplikasi memenuhi standar keamanan dan integritas data.   Kualifikasi  Pendidikan minimal S1 Ilmu Komputer, Teknologi Informasi, atau bidang terkait.  Memiliki pengalaman 1–4 tahun dalam pengembangan perangkat lunak.  Memiliki pengalaman dengan teknologi desktop atau client-server seperti Visual Basic, Delphi, atau framework legacy serupa.  Menguasai SQL dan konsep database dengan baik, termasuk query kompleks, stored procedures, dan konektivitas database.  Bersedia mempelajari dan bekerja dengan teknologi PowerBuilder.  Memiliki kemampuan komunikasi bahasa Inggris yang baik, baik lisan maupun tulisan.  Teliti serta memiliki kemampuan analisis yang kuat.  Mampu bekerja secara mandiri serta mendokumentasikan perubahan teknis dengan jelas.",https://id.jobstreet.com/id/job/91594201,Rp 13.000.000 – Rp 17.000.000 per month,web,indonesia,"['sql', 'r']",2,2026-04-20T20:54:54.053257
91256508,Procurement Engineer,PT Duraquipt Cemerlang,,"Kualifikasi Procurement Engineer:  Pendidikan S1 Jurusan apa saja / Lulusan S1 Teknik Mesin/Industri lebih diutamakan  Bisa berbahasa Inggris, baik lisan dan tulisan  Mengerti alur pembelian barang Lokal/import  Pengalaman 2-4 Tahun di Procurement Engineer  Menguasai MS Excel dengan baik  Deskripsi Pekerjaan :  Menangani pembelian import (Negosiasi, Sourcing, Membuat PO , Memonitor dan Mengontrol PO sampai di gudang)  Penjadwalan pembelian Lokal/import dalam rangka memastikan On Time Delivery  Bekerjasama dengan Team Expedite dan User  Mengontrol supplier  Mencari vendor-vendor baru  Menegosiasikan harga dengan pembanding dan tools lainnya  Komoditas lain yang ditangani : Consumable rutin Foundry, Kalibrasi dan admin petty cash  Kualifikasi Procurement Sipil :  Pendidikan minimal S1 jurusan Teknik Sipil dan Mesin   Memiliki pengalaman minimal 3 tahun sebagai Purchasing Staff  Memiliki pengalaman di bidang Konstruksi  Bersedia bekerja dihari sabtu dan lembur sampai malam   Jujur dan Cekatan dalam bekerja  Menguasai microsoft office excel   Teliti dan bisa mengerjakan pekerjaan administratif  Domisili Depok diutamakan  Bersedia bergabung secepatnya  Berpengalaman juga menghandle item konsumable kontrak, IT, GA dan HSE  Data Analisis atau Kataloger:  Pendidikan: Min D3 Ilmu Perpustakaan dan Informasi.  Pengalaman minimal 2 tahun sebagai supervisor di perpustakaan.  Pemahaman yang kuat tentang prinsip dan prosedur perpustakaan.  Keakraban dengan sistem otomasi perpustakaan dan database.  Menguasai Microsoft Office dan Slims. Penempatan di Cinere – Depok.  Qualifikasi sbb :   Rasionalisasi material, standardisasi dan pengayaan setiap item berdasarkan Standar Katalogisasi  Meninjau, Membersihkan, dan Memperbarui deskripsi master material agar lebih efektif dan efisien berdasarkan informasi yang tersedia dari permintaan pengguna  Nilai standar terhadap nilai yang diekstraksi di kolom terpisah.  Memastikan semua nilai atribut Wajib terisi dan jika tidak dapat diisi dengan nilai yang tersedia, lakukan pencarian web berdasarkan referensi Pabrikan seperti nomor Bagian, nomor Model  Melakukan pemeriksaan kualitas menyeluruh atas pekerjaan yang dilakukan oleh staf operator gudang.   Menerapkan proses penjaminan mutu untuk menjaga keakuratan dan keandalan data  Melakukan Verifikasi Fisik di Gudang.  Menggali dan mengembangkan data besar (big data) untuk membantu dalam hal pembuatan keputusan yang lebih baik",https://id.jobstreet.com/id/job/91256508,,web,indonesia,['r'],1,2026-04-20T20:55:14.777218
91591942,Lowongan Kerja Full Time Admin Marketing Balikpapan Timedoor Balikpapan,PT Timedoor Indonesia,,"Info Terbaru Lowongan Kerja Full time Admin Marketing Balikpapan Balikpapan April 2026 di Timedoor. Selamat Pagi bagi agan yang sedang mencari pekerjaan. Semoga tidak menyerah untuk mencari pekerjaan yang pas dengan keinginan Anda. Memang terkadang mencari pekerjaan yang pas sangatlah tidak mudah di tahun 2026 ini. Pada kesempatan ini admin akan memberikan informasi Lowongan Kerja Full time Admin Marketing Balikpapan Balikpapan April 2026 di Timedoor. Berikut ini info lebih lengkap mengenai Lowongan Kerja Full time Admin Marketing Balikpapan Balikpapan April 2026 Timedoor.  Lowongan Kerja Full time Admin Marketing Balikpapan Balikpapan April 2026 Timedoor   Berikut ini adalah kualifikasi yang harus Anda penuhi untuk mendaftar Lowongan Kerja Full time Admin Marketing Balikpapan Balikpapan April 2026 Timedoor yang dibuka pada 16 April 2026 ini:  Hai! Timedoor Academy sedang mencari kandidat untuk posisi (Fulltime) Administrasi dan Marketing untuk cabang kami di Balikpapan  Komplek Ruko Balikpapan Baru, Sentra Eropa II Blok AB 6 No. 18, Damai, Balikpapan, Kota Balikpapan, Kalimantan Timur 76114  Timedoor Academy (https://timedooracademy.com/) adalah perusahaan pendidikan IT yang berbasis di Bali dan menyediakan kursus pemrograman (web, game, pengembangan aplikasi) serta literasi digital (seperti keseimbangan digital, keamanan digital, dan hoaks) untuk anak-anak mulai dari TK, SD, SMP, hingga SMA.  Tanggung Jawab:  Meyakinkan calon pelanggan untuk bergabung dengan Timedoor Academy melalui strategi pemasaran online maupun offline. Melakukan layanan pelanggan melalui WhatsApp. Berkomunikasi dengan calon pelanggan, termasuk menjawab pertanyaan mengenai kelas. Mengajak calon siswa untuk mengikuti kelas percobaan (trial class). Menganalisis data penjualan dan menyiapkan strategi pemasaran. Membantu operasional kelas, administrasi, dan kegiatan marketing lainnya bersama tim.  Kompetensi yang Diperlukan:  Memiliki kemampuan komunikasi dan negosiasi yang baik dalam meyakinkan pelanggan. Memahami dasar-dasar operasional administrasi komputer (Excel, Google Sheets, dll). Disiplin, bertanggung jawab tinggi, dan memiliki inisiatif yang baik. Mampu bekerja dalam tim. Memiliki kemampuan bahasa Inggris (minimal pasif, aktif lebih diutamakan).  Job Types: Full-time, Contract  Experience:  Administrative: 3 years (Preferred)  Work Location: In person  Hanya kandidat yang memenuhi ketentuan di atas yang akan dipanggil untuk melakukan interview. Untuk itu jika Anda berminat dan memenuhi peserta Lowongan Kerja Full time Admin Marketing Balikpapan Balikpapan April 2026 Timedoor di atas, silahkan kirimkan lamaran Anda sebelum lowongan expired.  Demikian info Lowongan Kerja Full time Admin Marketing Balikpapan Balikpapan April 2026 Timedoor yang dapat kami sampaikan. Semoga informasi lowongan kerja hari ini membantu Anda sekalian yang sedang mencari pekerjaan. Jika Info lowongan kerja di atas tidak cocok dengan impian Anda, tidak ada salahnya untuk membaca info lowongan kerja lainnya di bawah ini. Akhir kata kami ucapkan kam sia sudah mengunjungi website ini, jangan lupa untuk membagikan informasi bermanfaat ini melalui twitter. Selamat mencari kerja dan berkarya!  Jika kamu tertarik melamar Lowongan Kerja Full time Admin Marketing Balikpapan Balikpapan April 2026 Timedoor, segera siapkan berkas lamaran dan dokumen yang diminta untuk mengisi Lowongan Kerja Full time Admin Marketing Balikpapan Balikpapan April 2026 Timedoor tersebut. Silakan klik tombol ""Kirim Lamaran"" di bawah ini.    Kirim Lamaran",https://id.jobstreet.com/id/job/91591942,,web,indonesia,"['r', 'git']",2,2026-04-20T20:55:28.735920
91594606,Junior IT Testing,PT Tiga Daya Digital Indonesia,,"Job Desc:  Execute software testing activities to support SIT (System Integration Testing) and UAT (User Acceptance Testing) processes in the banking industry.  Analyze business and system requirements to design and develop effective test scenarios and test cases.  Perform testing across multiple platforms, including API, Mobile, Web, and Desktop applications.  Document test results, defects, and overall testing progress in accordance with defined test scripts and standards.  Collaborate with developers, business analysts, and stakeholders to ensure issues are properly identified and resolved.  Support defect tracking, retesting, and validation processes to ensure system quality before release.   Qualiciations:  Minimum 2 years of experience as a Software Tester, with hands-on involvement in SIT/UAT within the banking industry.  Strong understanding of requirement analysis and test case/test script creation.  Experience in testing across multiple platforms: API, Mobile, Web, and Desktop applications.  Ability to perform structured and detailed test documentation.  Familiarity with defect tracking and test management tools.  Knowledge of automation testing is a plus.",https://id.jobstreet.com/id/job/91594606,,web,indonesia,"['r', 'ios']",2,2026-04-20T20:55:34.271715
91598216,Fullstack Developer,PT Yayasan utama kasih,,"""Kualifikasi Teknis (Hard Skills)1. Penguasaan Framework: Mahir menggunakan library/framework modern seperti React.js, Vue.js, atau Angular serta menguasai MVC .Net dan .Net Core .2. Dasar Web: Pemahaman mendalam tentang HTML5, CSS3 (SASS/LESS) , dan JavaScript (ES6+).3. Server-side: Menguasai salah satu bahasa backend utama seperti Node.js (Express), Python (Django/FastAPI), PHP (Laravel), atau Go serta .Net4. Manajemen Database: Pengalaman bekerja dengan database PostgreSQL, MySQL, SQL Server.5. API Development: Mampu merancang, mendokumentasikan, dan mengintegrasikan RESTful API .6. Reporting : Menguasai pembuatan reporting dengan menggunakan Crystal Report,Reporting Services .7. Version Control: Mahir menggunakan Git (GitHub/GitLab/Bitbucket).8. Cloud & Deployment: Familiar dengan layanan cloud seperti AWS, Google Cloud, atau Azure .Kualifikasi Non -Teknis (Soft Skills)1. Problem Solving: Kemampuan menganalisis masalah kompleks dan memecahkannya menjadi solusi teknis yang efisien.2. Adaptabilitas: Cepat belajar teknologi baru .3. Komunikasi: Mampu menjelaskan konsep teknis kepada user, serta dapat berkomunikasi yang baik dengan sesama anggota tim IT maupun dengan user.4. Detail -Oriented: Memiliki perhatian tinggi terhadap kualitas kode, keamanan data, dan performa aplikasi.Persyaratan Pengalaman & Pendidikan1. Gelar Sarjana (S1) di bidang Teknik Informatika, atau Sistem Informasi .2. Pengalaman kerja minimal 5 tahun sebagai Fullstack Developer.3. Memiliki portofolio proyek yang bisa ditunjukkan (link GitHub atau website hidup).4. Pengalaman di bidang finance/banking"" - - Berpengalaman- S1- Tidak ada batasan usia- Terima kandidat tanpa foto diri- Terima kandidat dari mana saja",https://id.jobstreet.com/id/job/91598216,,web,indonesia,"['fastapi', 'azure', 'aws', 'java', 'angular', 'php', 'sql', 'javascript', 'express', 'postgresql', 'python', 'django', 'react', 'r', 'mysql', 'vue', 'git']",17,2026-04-20T20:55:39.411484
91591447,Software Integration Project Manager,PT Giesecke & Devrient Indonesia,,"Area of responsibility  Successfully run and complete projects implementing Vault Management, Warehouse management and/or Production software with additional developments within our client’s organization, within the agreed timelines, budget and quality criteria.  Contributing to project budget calculations and presentations to clients in the pre-sales phase.  Management of resources and distribution of tasks across projects in coordination with the resources involved.  Within quotation processes, the SW Project Manager analyses the implementation strategy and impact.  Within projects the SW Project Manager is able to write requirements, work with the development team and perform acceptance tests.     Main tasks   Integrate Software Products  SW Product Integration capabilities  Proven experience of file transfer mechanism, new integration platforms/APIs  Porting or migration from legacy integration footprints to modern integration landscapes  Large application implementations with significant integration components including ESB, web-services, file transfers, point to point integrations     Execute resource management  Anticipating on project timelines by resource allocation scenarios with a horizon of 3-36 months.  Continuous resource and (project) task allocation management based on the dynamics.  Ownership of the project related resource anticipation sheet with a 3-36 month horizon.  Continuous management of proper task allocation and commitment across projects.  Discussing and challenging task requirements and anticipated effort.  Anticipating and discussing development requirements with the Product and Service Manager (internal and external) for alignment with project timelines.  Control project activities of all involved stakeholders and address issues like missing tasks, improper task descriptions, non-committed tasks, overdue tasks, etc.  Managing people’s proper project contributions regarding taking task and due date responsibility and delivering high quality.        Manage and execute projects  Managing large projects or programs with multiple projects or work streams operating in parallel with internal and external dependencies  Executing projects with significant third party dependencies and stakeholder management to align delivery time frames and testing  Creation of detailed project plans consisting of scope, deliverables, budget, delivery and lead times, resource planning, risks & mitigations, communication and reporting.  Organize proper project teams and their involvement in the creation of plans and commitment to the tasks.  Monitor and manage project involved in order to achieve quality and timely deliveries.  Coaching of project involved and Sales team members regarding project management.  Manage risks, resources, issues across all projects with a horizon 3-36 months.  Intervene when project involved cannot resolve project issues.  Plan and manage transfers from project to support.  Regular communication with and visits to clients where projects are operative, informing them about the progress of the projects.  Organization and execution of the steering committee meetings and ensure proper governance.  Organize project evaluations and lessons learned registration, for future use.  Continuous improvement of the processes.     Authorities  Management of implementation project budgets.  Deciding on (priorities relating to) the use of internal and external employees.  Deciding on task allocations.  Deciding on project standards and methodologies.     Result areas  (Client) project objectives and results.  Commercial project success.  Project organisation - quality and effectiveness.  Satisfaction of principals, clients, relations.  Quality and implementation of improvement suggestions.        Job requirements   Knowledge  Project management  Handling cash and cash management processes  Concepts and models for supply chain integration and logistics  Software product and services of G+D  Business process (re)design  G+D Strategy  Skills  Project management  Interpersonal skills (including communication)  Planning and organizing  Conflict handling     Competences  Ability to remain positive, with a 'can do' attitude  Ability to find pragmatic solutions to challenges  Forward thinking  Result orientation  Managing performance  Decisiveness  Persuasiveness  External awareness",https://id.jobstreet.com/id/job/91591447,Rp 25.000.000 – Rp 35.000.000 per month,web,indonesia,"['r', 'ios']",2,2026-04-20T20:55:45.261746
91591408,Magang Admin Data Entry (Magang/PKL untuk SMK/Sarjana),PT. Djaja Indonesia Liputan,,"Bergabunglah dengan SEVIMA – Pioneer EdTech di 1200+ Kampus Indonesia! Kami membuka kesempatan Internship Admin Support untuk kamu yang enerjik dan detail-oriented. Selama 6 bulan, kamu akan:     Membantu tim operasional dalam pengelolaan data dan administrasi harian, termasuk, namun tidak terbatas pada:  Input dan pembersihan data kontak institusi (kampus, lembaga, perusahaan) ke dalam spreadsheet  Riset dan pencarian informasi dasar melalui Google (website kampus, kementerian, lembaga pelatihan)  Membantu pengelolaan dokumen dan surat-menyurat dalam jumlah besar  Memantau dan merangkum informasi dari website resmi (LLDIKTI, direktorat kementerian) terkait agenda atau acara mendatang  Koordinasi harian via WhatsApp dengan anggota tim terkait  Membantu administrasi dan pencatatan data program magang (Maganghub)  Pengolahan data sederhana menggunakan Excel (input, sorting, filter)  Pencarian database sederhana: sekolah, HRD/IT perusahaan, lembaga sertifikasi (LSP/LPK), program beasiswa      Keterampilan dan kualifikasi yang diperlukan:  Bisa mengoperasikan Microsoft Excel dan Google Sheets (dasar: input data, filter, sort), dan siap belajar lebih detil lagi atas berbagai rumus excel  Terbiasa menggunakan WhatsApp Web dan Google Search  Teliti, rapi, dan konsisten dalam mencatat data  Mampu mengikuti instruksi tertulis secara mandiri  Responsif dan aktif berkomunikasi via chat harian  Tidak harus berpengalaman — yang penting mau belajar dan tidak perlu diingatkan berulang kali  Terbuka untuk seluruh jurusan, SMK/Kuliah/sudah lulus, diutamakan S1 Statistika      Benefit Internship di SEVIMA:  Makan Siang  Honor Magang  Sertifikat Magang  Lokasi: Surabaya, Jawa Timur (Onsite)",https://id.jobstreet.com/id/job/91591408,Rp1.000.000 per month,web,indonesia,['r'],1,2026-04-20T20:55:50.902491
91591279,STAFF DX,PT Abadi Tambah Mulia Internasional,,"Kualifikasi Umum  Pendidikan minimal S1 di bidang: Teknik Informatika/Sistem Informasi/Ilmu Komputer, atau bidang terkait  Memiliki pengalaman minimal 1–3 tahun di bidang IT / Digital Transformation (fresh graduate dipertimbangkan dengan portofolio kuat)  Memiliki kemampuan komunikasi dan problem solving yang baik  Kualifikasi Teknis (Wajib)  Menguasai minimal satu bahasa pemrograman:  Python (diutamakan)  Java / JavaScript / C# / Go (nilai tambah)  Memahami konsep:  API (REST / JSON)  Database (MySQL, PostgreSQL, atau NoSQL)  Pengalaman menggunakan:  Git (version control)  Framework (seperti FastAPI, Django, .NET, Node.js)  Kemampuan AI & Digital Transformation  Memahami dasar Artificial Intelligence / Machine Learning  Pernah membuat atau terlibat dalam project:  Machine Learning (klasifikasi, prediksi, dll)  Computer Vision / NLP (nilai tambah)  Familiar dengan tools/libraries:  TensorFlow / PyTorch / Scikit-learn  Pandas, NumPy  Memahami konsep:  Data preprocessing  Model training & evaluation  Nilai plus jika:  Pernah deploy model ke production (API / web app / Streamlit)",https://id.jobstreet.com/id/job/91591279,Rp 6.000.000 – Rp 8.000.000 per month,web,indonesia,"['fastapi', 'scikit-learn', 'java', 'tensorflow', 'c#', 'sql', 'javascript', 'numpy', 'pytorch', 'postgresql', 'python', 'django', 'r', 'pandas', 'mysql', 'git']",16,2026-04-20T20:55:56.208083
